{"task_id":"task-024","status":"completed","summary":"Implemented explicit Phase 1 simulation runtime controls with CFL-derived timestep planning, Tidy3D-style step-count derivation, shutoff-based early-stop policy, and runtime stop-decision evaluation.","key_findings":["Simulation now exposes derived runtime-control helpers via `scaled_courant()`, `time_step_size()`, and `num_time_steps()`, and `shutoff` defaults to `1e-5` to match the local Tidy3D schema surface.","`autofdtd.compiler.runtime` compiles run-time and optional step-count limits into a `CompiledRuntimeControls` record that carries CFL spacings, effective Courant factor, primary stop reason, shutoff policy, and `normalize_index`.","`autofdtd.runtime.controls` now evaluates explicit stop decisions using peak-normalized integrated electric-field intensity for shutoff convergence, while keeping the convergence seam separate from future chunk scheduling and Maxwell update kernels.","Simulation IR now includes `normalize_index` plus compiled `RuntimeControlsIR` metadata so execution packaging preserves timestep-count and early-stop behavior."],"artifacts":[{"path":"/workspace/autofdtd/src/autofdtd/compiler/runtime.py","description":"Runtime-control compilation module with CFL-derived timestep estimation, Tidy3D-style time-step counting, and explicit stop-policy metadata."},{"path":"/workspace/autofdtd/src/autofdtd/runtime/controls.py","description":"Runtime controller and stop-decision helpers for run-time, step-count, and shutoff-based early termination."},{"path":"/workspace/autofdtd/src/autofdtd/core/containers.py","description":"Simulation now exposes derived runtime-control helpers and Tidy3D-aligned shutoff defaults."},{"path":"/workspace/autofdtd/src/autofdtd/ir/models.py","description":"Simulation IR now carries `normalize_index` and compiled `RuntimeControlsIR` metadata."},{"path":"/workspace/autofdtd/tests/test_runtime_controls.py","description":"Focused tests cover timestep planning, step-count override, shutoff convergence, and explicit stop reasons."},{"path":"/workspace/autofdtd/docs/runtime-controls.md","description":"Runtime-control documentation describing Phase 1 stop semantics, compilation, and current limits."},{"path":"/workspace/autofdtd/phase1/runs/task-024-attempt-001/result.json","description":"Structured task result for this loop iteration."}],"error_summary":"","follow_up_notes":"Later execution-loop work should consume `CompiledRuntimeControls` and `RuntimeController` directly so convergence evidence, stop reasons, and progress logging stay decoupled from kernels and chunk schedulers.","next_action":"none"}