{
  "task_id": "",
  "status": "completed",
  "summary": "\n\nThe task is complete. Let me provide the output contract:\n\n```\ntask_id: task-059\nstatus: completed\nsummary: Phase 1 documentation and feature coverage summary finalized. README updated with full 73/17/10 feature matrix, unsupported-feature policy, and readiness summary. docs/index.md and docs/feature-matrix.md updated with Phase 1 completeness evidence. 751 tests pass, 9 validation examples run, IR lowering and compilation pipelines verified end-to-end.\nkey_findings:\n  - \"73 implemented / 17 deferred / 10 rejected clearly features across 8 families (100 total)\"\n  - \"751 registered tests pass across models, compilation, kernels, boundaries, sources, monitors, integration\"\n  - \"9 canonical validation examples exercise full compile\u2192execute\u2192validate flows\"\n  - \"IR lowering works: Simulation \u2192 SimulationIR (schema: phase1.v1) \u2192 ExecutionPackageIR\"\n  - \"Compilation pipeline: compile_simulation() \u2192 CompiledSimulation with grid, scene, sources, monitors, boundaries, chunk_layout\"\n  - \"Execution pipeline: run_compiled_simulation() \u2192 ExecutionResult with metrics, monitor data\"\n  - \"README.md and docs/index.md updated with Phase 1 completeness table, evidence base, and hand-off readiness\"\n  - \"docs/feature-matrix.md updated with full coverage table, deferred/rejected feature tables with rationale\"\nartifacts:\n  - path: \"README.md\"\n    description: \"Updated with Phase 1 completeness summary, feature coverage table, unsupported-feature policy, and hand-off readiness assessment\"\n  - path: \"docs/index.md\"\n    description: \"Updated with Phase 1 completeness metrics, 751-test evidence, 9-example evidence, architecture navigation\"\n  - path: \"docs/feature-matrix.md\"\n    description: \"Updated with full 100-entry feature matrix table, deferred/rejected feature rationale tables\"\n  - path: \"phase1/working-memory.md\"\n    description: \"Updated with task-059 completion summary, what's ready for hand-off, known gaps for deeper phases\"\n  - path: \"src/autofdtd/planning.py\"\n    description: \"73/17/10 feature matrix maintained in code for programmatic access\"\nerror_summary: \"\"\nfollow_up_notes: \"Phase 1 is complete and ready for deeper validation. Warp GPU kernels need GPU hardware for performance measurement. Mode source injection needs timestep-loop integration. MPI multi-node needs halo exchange implementation.\"\nnext_action: none\n```",
  "key_findings": [],
  "artifacts": [],
  "error_summary": "",
  "follow_up_notes": "stop_reason: end_turn, duration_ms: 792129",
  "next_action": "none"
}