{"task_id":"task-025","status":"completed","summary":"Implemented a dedicated Phase 1 runtime-logging seam with structured progress events, explicit stop records, and convergence-evidence capture on top of the existing runtime controller.","key_findings":["`autofdtd.diagnostics.runtime_logging` now defines immutable `RuntimeLogEvent`, `RuntimeConvergenceSample`, `RuntimeConvergenceEvidence`, and `RuntimeExecutionLog` models plus `RuntimeProgressLogger` for deterministic progress emission and stop-summary capture.","`autofdtd.runtime.run_until_stop_with_logging()` now drives the existing stop-policy controller while returning a structured execution log instead of only the final stop decision, keeping logging separate from solver kernels and future benchmark metrics.","Convergence evidence is captured for every shutoff check even when progress logging is downsampled, so Phase 1 runs preserve both operator-facing progress records and the full check history needed to diagnose early-stop behavior.","Focused tests and examples cover shutoff-triggered runs, step-limit runs, JSONL event export, and the new runtime-logging handoff surface."],"artifacts":[{"path":"/workspace/autofdtd/src/autofdtd/diagnostics/runtime_logging.py","description":"Structured runtime logging models, JSONL export, convergence evidence capture, and the reusable progress logger."},{"path":"/workspace/autofdtd/src/autofdtd/runtime/controls.py","description":"Logged execution helper layered on the existing runtime controller."},{"path":"/workspace/autofdtd/tests/test_runtime_logging.py","description":"Focused tests for progress emission, stop-reason capture, convergence evidence, and JSONL event export."},{"path":"/workspace/autofdtd/docs/runtime-logging.md","description":"Documentation describing the Phase 1 runtime-logging seam and its separation from benchmark metrics."},{"path":"/workspace/autofdtd/src/autofdtd/examples/runtime_controls.py","description":"Runtime logging example showing a shutoff-limited control loop and the resulting structured log bundle."},{"path":"/workspace/autofdtd/phase1/runs/task-025-attempt-001/result.json","description":"Structured task result for the runtime-logging implementation."}],"error_summary":"","follow_up_notes":"Verified with `PYTHONPATH=src python -m pytest -q tests/test_runtime_controls.py tests/test_runtime_logging.py`, `PYTHONPATH=src python -m pytest -q tests/test_imports.py`, `PYTHONPATH=src python -m compileall src`, and a direct `runtime_logging_demo()` smoke run. `ruff` was not available in this environment. Later timestep-loop work should reuse `RuntimeProgressLogger` and `RuntimeExecutionLog` directly so full Maxwell runs and future throughput metrics share one structured progress format.","next_action":"none"}