{
  "task_id": "",
  "status": "completed",
  "summary": "\n\nAll tests pass. Let me provide a summary of the task completion:\n\n## Summary\n\n**Task 035: Implement TFSF support and source-frame policy** - COMPLETED\n\n### Implementation Artifacts\n\n1. **Public API Model** (`src/autofdtd/sources/tfsf.py`):\n   - `TFSF` class with all required fields: center, size, source_time, injection_axis, direction, angle_theta, angle_phi, pol_angle, num_freqs\n   - Volume geometry validation (all three dimensions must be non-zero)\n   - `injection_plane_center` property for locating the injection face\n   - `_dir_vector` and `_pol_vector` for direction and polarization vectors\n   - `_tangential_axes` for identifying the two non-injection axes\n\n2. **IR Lowering** (`src/autofdtd/ir/models.py`):\n   - `TFSFIR` typed IR model\n   - `source_to_ir()` lowering for TFSF\n   - `TFSFIR` added to `SourceComponentIR` union type\n   - TFSF added to `component_to_ir()` source dispatch\n\n3. **Compilation** (`src/autofdtd/compiler/sources.py`):\n   - `CompiledTFSF` dataclass with placement data, direction vectors, and `tfsf_bounds_indices`\n   - `compile_tfsf()` function for grid-based compilation\n\n4. **Injection Kernel** (`src/autofdtd/kernels/sources.py`):\n   - `inject_tfsf()` function implementing equivalence principle injection\n   - Full TFSF boundary correction (TF/SF separation at box edges) is noted as deferred to future task\n\n5. **Runtime Support** (`src/autofdtd/runtime/sources.py`):\n   - `build_tfsf_runtime()` function\n   - `apply_tfsf_sources()` batch application function\n\n6. **Exports**: All relevant exports added to `sources/__init__.py`, `compiler/__init__.py`, `kernels/__init__.py`, `runtime/__init__.py`, and `ir/__init__.py`\n\n7. **Test Suite** (`tests/test_sources_tfsf.py`):\n   - 14 comprehensive tests covering: geometry validation, injection axis, bounds, direction vectors, IR lowering, compilation, runtime build, injection kernel, runtime application, source-time integration, reference wavelength, TFSF bounds, tangential axes, and serialization\n\n### Key Findings\n\n- Phase 1 TFSF implements the injection component (incident plane wave injected at the TFSF injection plane)\n- Full TF/SF boundary correction at the six box faces is documented as deferred - it requires tracking the incident field separately and subtracting it at the boundary\n- The TFSF direction vector convention follows `direction=\"+\"` \u2192 propagates in `+injection_axis` direction\n- The model correctly inherits from `TaggedModel` and uses JSON-safe serialization\n\n### Next Action\n\nThe task is complete with all 14 tests passing. `next_action: none`",
  "key_findings": [],
  "artifacts": [],
  "error_summary": "",
  "follow_up_notes": "stop_reason: end_turn, duration_ms: 809834",
  "next_action": "none"
}