{
  "task_id": "",
  "status": "completed",
  "summary": "## Summary\n\n**Task 064: Implement cross-device halo exchange** - COMPLETED\n\n### What was implemented\n\n1. **New `CrossDeviceHaloTransfer` class** (`runtime/boundaries.py`):\n   - Manages explicit CUDA memcpy for cross-device halo exchange when peer access is not supported\n   - Uses D2H \u2192 host staging \u2192 H2D pattern for inter-device transfers\n   - `is_cross_device_face()` - detects when a face requires cross-device transfer\n   - `get_transfer_devices()` - returns source/destination device pair\n   - `allocate_staging_buffer()` - allocates host-side staging buffers\n   - `cuda_device_to_host()` - copies from GPU to host\n   - `cuda_host_to_device()` - copies from host to GPU\n   - `transfer_face_halo()` - performs full cross-device transfer with staging\n\n2. **Extended `ChunkHaloExchange`** with cross-device methods:\n   - `is_cross_device_face()` - detects cross-device faces on a chunk layout\n   - `get_face_devices()` - returns device pair for a face\n   - `cross_device_transfer()` - performs staging transfer between chunks on different devices\n\n3. **New tests** in `test_kernels_boundaries.py`:\n   - `TestCrossDeviceHaloTransfer` - 8 tests for the new transfer class\n   - `TestChunkHaloExchangeCrossDevice` - 4 tests for cross-device extensions\n\n### Key findings\n- For a 2-GPU layout `(2,1,1)` split along x with PML boundaries:\n  - Chunk 0 x.plus and Chunk 1 x.minus are interior exchanges at depth=1 (not domain boundaries)\n  - Chunk 0 x.minus and Chunk 1 x.plus are PML domain boundaries at depth=10\n  - Chunk 0 x.plus \u2192 Chunk 1 x.minus IS cross-device (different GPUs)\n- Since CUDA peer access is not supported in this environment, cross-device transfers require explicit D2H then H2D staging through host memory\n\n### Test results\n- **770 tests pass** (all tests)\n- 14 new cross-device tests added and passing",
  "key_findings": [],
  "artifacts": [],
  "error_summary": "",
  "follow_up_notes": "stop_reason: end_turn, duration_ms: 938488",
  "next_action": "none"
}