{
  "task_id": "",
  "status": "completed",
  "summary": "\n\n## task-040 completion summary\n\n**Status: `completed`**\n\n### Summary\nImplemented mode-monitor families for `ModeMonitor` and `ModeSolverMonitor` with full integration into the mode-solver subsystem, overlap kernels, and runtime recording infrastructure.\n\n### Key Findings\n\n1. **ModeMonitor and ModeSolverMonitor** already existed as public models with `mode_spec`, `direction`, `num_freqs`, and `freqs` fields - no new model classes needed.\n\n2. **Mode overlap computation** uses a Poynting-flux-style overlap integral: `S_normal = E_tangential \u00d7 H_mode*` projected onto the cross-sectional plane, computed discretely over monitor cell placements.\n\n3. **Normal axis inference** for mode monitors works identically to flux monitors - the zero-size dimension determines the cross-sectional plane.\n\n4. **Two recording modes** are supported:\n   - Time-domain: stores amplitude time-series when no frequencies specified\n   - Frequency-domain: accumulates DFT of mode amplitudes when `freqs` is provided\n\n5. **ModeSolutions** from the mode solver are stored in `ModeMonitorState` and used for overlap computation against runtime field data.\n\n6. **IR lowering** for `ModeMonitor` and `ModeSolverMonitor` was already implemented in task-036 via `monitor_to_ir()`.\n\n### Artifacts\n\n| Path | Description |\n|------|-------------|\n| `src/autofdtd/compiler/monitors.py` | Added `CompiledModeMonitor`, `compile_mode_monitor()`, `ModeMonitorState` with overlap computation and time/frequency domain recording |\n| `src/autofdtd/kernels/monitors.py` | Added `mode_monitor_kernel_metadata()`, `extract_mode_field_components()`, `compute_mode_overlap()`, `record_mode_time_domain()`, `record_mode_frequency_domain()` |\n| `src/autofdtd/runtime/monitors.py` | Added `build_mode_monitor_runtime()`, `record_monitor_modes()`, `extract_mode_monitor_data()` |\n| `tests/test_monitors_mode.py` | 26 tests covering normal axis inference, model construction, compilation, state management, kernel functions, runtime integration, and IR lowering |\n\n### Test Results\n```\ntests/test_monitors_mode.py: 26 passed in 0.47s\ntests/test_monitors.py: passed\ntests/test_monitors_field.py: passed\ntests/test_monitors_medium.py: passed\ntests/test_monitors_flux.py: passed\n```",
  "key_findings": [],
  "artifacts": [],
  "error_summary": "",
  "follow_up_notes": "stop_reason: end_turn, duration_ms: 638981",
  "next_action": "none"
}