{"task_id":"task-005","status":"completed","summary":"Implemented a shared frozen model contract for tagging, copy-or-update, and JSON serialization, then moved the public container and IR layers onto it with passing tests.","key_findings":["Added `src/autofdtd/core/models.py` with `AutoFDTDModel`, `TaggedModel`, and `json_ready()` as the common contract for Phase 1 models.","`Structure`, `Scene`, `Simulation`, and all IR models now inherit shared serialization and `copy_update()` behavior instead of duplicating helpers in subsystem-local base classes.","Exported the shared base types through `autofdtd.core`, `autofdtd.api`, and package root so later feature families can depend on one stable model surface.","Extended tests to cover generic tag lookup, immutable copy/update behavior, and shared helper usage across both API and IR layers.","Updated working memory and README to record the decision that shared model behavior must live in `autofdtd.core.models`."],"artifacts":[{"path":"src/autofdtd/core/models.py","description":"New shared base-model module with frozen model config, tag access, copy/update helper, JSON serialization, and generic JSON-normalization utility."},{"path":"src/autofdtd/core/containers.py","description":"Public container models switched to the shared tagged base contract."},{"path":"src/autofdtd/ir/models.py","description":"IR models switched to the shared tagged base and common JSON helper."},{"path":"tests/test_containers.py","description":"Added coverage for shared model helpers and container tag behavior."},{"path":"tests/test_ir.py","description":"Added coverage for IR copy/update behavior on the shared model contract."},{"path":"phase1/working-memory.md","description":"Recorded the new shared-model decision and reusable facts for later tasks."}],"error_summary":"","follow_up_notes":"Verified with `python -m pytest` from `/workspace/autofdtd`; all 24 tests passed.","next_action":"none"}