{"task_id":"task-021","status":"completed","summary":"Implemented baseline PML boundary support across the public API, typed IR, boundary compilation, runtime state allocation, staged kernel updates, examples, and absorption-focused tests.","key_findings":["Added Tidy3D-shaped baseline `PML` and `PMLParams` models plus `Boundary.pml(...)` / `BoundarySpec.pml(...)` constructors and zero-dimension coercion behavior.","Extended boundary IR with typed `PMLIR` and `PMLParamsIR`; `BoundarySpecIR` now records `pml_axes` and `pml_faces` so scene lowering preserves absorbing-face metadata explicitly.","Boundary compilation now prepares per-face polynomial PML coefficient profiles (`sigma`, `kappa`, `alpha`, attenuation, memory terms) and advertises explicit `electric_pml` / `magnetic_pml` stage ordering.","Runtime now allocates persistent per-face PML memory via `allocate_pml_boundary_state()` and applies PML stages through `apply_boundary_stages()` / `BoundaryRuntime.apply()`.","Representative tests now cover typed PML lowering, coefficient prep, face-state allocation, and staged absorption behavior; full suite passes with `PYTHONPATH=src python -m pytest -q` (110 passed)."],"artifacts":[{"path":"/workspace/autofdtd/src/autofdtd/boundaries/models.py","description":"Baseline PML public models and boundary constructors."},{"path":"/workspace/autofdtd/src/autofdtd/ir/models.py","description":"Typed PML IR models and boundary-spec PML metadata lowering."},{"path":"/workspace/autofdtd/src/autofdtd/compiler/boundaries.py","description":"Compiled PML coefficient preparation and boundary-stage metadata."},{"path":"/workspace/autofdtd/src/autofdtd/kernels/boundaries.py","description":"Boundary kernel stages including PML layer damping with persistent face memory."},{"path":"/workspace/autofdtd/src/autofdtd/runtime/boundaries.py","description":"Runtime state allocation and staged boundary application wrapper."},{"path":"/workspace/autofdtd/tests/test_boundaries.py","description":"Representative PML validation and absorption tests."},{"path":"/workspace/autofdtd/src/autofdtd/examples/boundaries.py","description":"Boundary runtime snapshots including a compact PML absorption example."},{"path":"/workspace/autofdtd/phase1/working-memory.md","description":"Updated Phase 1 handoff notes for baseline PML support and extension seams."}],"error_summary":"","follow_up_notes":"Current PML support is intentionally narrow: it uses a staged damping-layer backend with persistent face memory rather than a full split-field CPML. `StablePML` and `Absorber` should extend the compiled-face/state contract in task-022.","next_action":"none"}