{"task_id":"task-026","status":"completed","summary":"Implemented Phase 1 `GaussianPulse` and `ContinuousWave` source-time profiles with immutable public models, typed IR lowering, and representative waveform tests.","key_findings":["`src/autofdtd/sources/time.py` now defines `SourceTime` and `Pulse` bases plus concrete `GaussianPulse` and `ContinuousWave` models with finite parameter validation, analytic `amp_time()` evaluation, `frequency_range()`, and explicit `end_time()` behavior.","`src/autofdtd/ir/models.py` now adds typed `GaussianPulseIR` and `ContinuousWaveIR` models plus `source_time_to_ir()`, and generic source envelopes lower nested `source_time` payloads into typed IR dicts.","Public exports were wired through `autofdtd.sources`, `autofdtd.api`, and the package root so later source families can reuse the same tagged source-time surface.","Verification passed with `PYTHONPATH=src python -m pytest -q` (134 passed) and `PYTHONPATH=src python -m compileall src/autofdtd tests`.","`ruff` and `mypy` were not installed in the current environment, so lint/type-check verification could not be run."],"artifacts":[{"path":"/workspace/autofdtd/src/autofdtd/sources/time.py","description":"Phase 1 source-time model implementations for `GaussianPulse` and `ContinuousWave`."},{"path":"/workspace/autofdtd/src/autofdtd/ir/models.py","description":"Typed source-time IR models and nested source payload lowering."},{"path":"/workspace/autofdtd/tests/test_sources_time.py","description":"Focused validation, waveform-shape, and direct source-time IR tests."},{"path":"/workspace/autofdtd/tests/test_ir.py","description":"Simulation IR tests updated to cover nested source-time lowering inside source envelopes."},{"path":"/workspace/autofdtd/phase1/runs/task-026-attempt-001/result.json","description":"Recorded task result matching the Phase 1 output schema."}],"error_summary":"","follow_up_notes":"`task-027` should extend `source_time_model_from_value()` and `source_time_to_ir()` for `BroadbandPulse` and `CustomSourceTime` rather than introducing parallel waveform parsing paths.","next_action":"none"}