{
  "task_id": "",
  "status": "completed",
  "summary": "## Task 045 Complete\n\nBuilt the scene-compilation pipeline that orchestrates public API \u2192 IR \u2192 compiled runtime artifacts.\n\n### New Artifact\n- **`src/autofdtd/compiler/pipeline.py`**: Top-level compilation entry point with 7-stage pipeline documented in module docstring\n\n### Key Deliverables\n\n**`compile_simulation()`** - Main entry point that orchestrates:\n1. Grid resolution (`simulation.resolved_grid()`)\n2. IR lowering (`simulation_to_ir()`)\n3. Runtime controls compilation\n4. Scene materialization (material coefficients)\n5. Source planning\n6. Monitor planning\n7. Boundary planning\n\n**Container types** (all frozen dataclasses):\n- `CompiledSimulation` - holds all compiled artifacts\n- `CompiledSceneCoefficients` - background + structure material coefficients\n- `CompiledSources` - all source types by category\n- `CompiledMonitors` - all monitor types by category\n- `CompiledBoundaries` - boundary spec + PML/ABC state flags\n\n**`simulation_to_execution_package()`** - Combines compilation with `ExecutionPackageIR` bundling for transport\n\n### Verification\n```\nGrid shape: (100, 100, 100)\nTotal cells: 1,000,000\nNum sources: 1\nNum monitors: 2 (field + flux)\nRuntime dt: 1.91e-11\nRuntime num_steps: 2\nPackage format: autofdtd.execution-package.v1\n```\n\nAll 84 existing tests pass.",
  "key_findings": [],
  "artifacts": [],
  "error_summary": "",
  "follow_up_notes": "stop_reason: end_turn, duration_ms: 881227",
  "next_action": "none"
}